{"archive":{"maxCompressionRatio":{"denominator":1,"numerator":100},"maxEntries":10000,"maxEntryBytes":67108864,"maxEntryPathUtf8Bytes":512,"maxExpandedBytes":536870912,"maxNestingDepth":0,"rejectAbsolutePaths":true,"rejectAsciiCaseFoldCollisions":true,"rejectBackslashes":true,"rejectCanonicalPartCollisions":true,"rejectDrivePrefixes":true,"rejectDuplicateEntries":true,"rejectEmptyOrDotSegments":true,"rejectEncryptedEntries":true,"rejectNul":true,"rejectParentSegments":true,"rejectSymlinks":true,"requireNfcNames":true,"requireUtf8Names":true,"verifyLocalHeaderAndDataDescriptor":true},"canonical":{"maxCanonicalBytes":1,"maxLocatorAnchors":1,"maxNormalizationSegments":1,"maxSourceFragmentsPerAnchor":1,"maxSourcePositionsPerSegment":1,"maxTextBufferBytes":1,"maxViewsPerFragment":1},"entities":{"maxAssets":1,"maxBlocks":1,"maxCells":1,"maxChunks":1,"maxCsvColumns":1,"maxCsvFieldBytes":1,"maxCsvRows":1,"maxPdfObjects":1,"maxShapes":1,"maxSharedStrings":1,"maxTables":1},"harnessOutput":{"maxActiveRuns":1,"maxAggregateBytes":268435456,"maxArtifactBytes":67108864,"maxFiles":10000,"parentTmpfsBytes":536870912,"parentTmpfsInodes":20000,"reservedBytes":268435456,"reservedInodes":10000},"profileRevision":1,"protocol":{"maxHeaderBytes":16384,"maxRequestBodyBytes":52428800,"maxResultBytes":1},"sandbox":{"childAddressSpaceBytes":1,"childCoreBytes":0,"childCpuSeconds":1,"childFileBytes":1,"childOpenFiles":1,"childProcesses":1,"maxConcurrentInvocations":1,"maxWaitingInvocations":1,"sidecarMemoryBytes":1,"sidecarPids":1,"sidecarTmpfsBytes":1,"wallTimeoutMillis":1},"schemaVersion":"parser-resource-profile.v1","source":{"maxPdfPages":500,"maxSourceBytes":52428800},"xml":{"maxAttributes":1,"maxDepth":1,"maxNodes":1,"maxTextBytes":1,"maxTotalBytes":1}}